<?xml version="1.0" encoding="utf-8"?>
<!DOCTYPE Annotation PUBLIC "-//GREC//DTD GREC EVENT ANNOTATION//EN" "../GRECResources/GREC_event.dtd">
<Annotation created="11/5/2009" creator="a4" annotates="http://www.ncbi.nlm.nih.gov/entrez/eutils/efetch.fcgi?db=pubmed&amp;retmode=xml&amp;rettype=medline&amp;id=11591675">
<PubmedArticleSet>
<PubmedArticle>
<MedlineCitation>
<PMID>11591675</PMID>
<Article>
<ArticleTitle>
<sentence id="S1">Contributions of UP elements and the transcription factor FIS to expression from <term sem="Promoter" id="T1" lex="the_seven_rrn_P1_promoters">the seven rrn P1 promoters</term> <term sem="SPAN" id="T2" lex="in_Escherichia_coli">in <term sem="Bacteria" id="T3" lex="Escherichia_coli">Escherichia coli</term></term>.</sentence>
<event id="E1">
<type class="Gene_Expression" />
<Location idref="T2" />
<Source idref="T1" />
<clue>Contributions of UP elements and the transcription factor FIS to <clueType>expression</clueType> from the seven rrn P1 promoters in Escherichia coli.</clue>
</event>
</ArticleTitle>
<Abstract>
<AbstractText>
<sentence id="S3"><term sem="SPAN" id="T4" lex="The_high_activity">The high activity</term> of the rrnB P1 promoter in Escherichia coli results from <term sem="DNA" id="T5" lex="a_cis-acting_DNA_sequence">a cis-acting DNA sequence</term>, <term sem="DNA" id="T6" lex="the_UP_element">the UP element</term>, and a trans-acting transcription factor, <term sem="Transcription_Factor" id="T7" lex="FIS">FIS</term>.</sentence>
<event id="E2">
<type class="GRE" />
<Agent idref="T5" idref1="T6" idref2="T7" />
<Theme idref="T4" />
<clue>The high activity of the rrnB P1 promoter in Escherichia coli <clueType>results</clueType> from a cis-acting DNA sequence, the UP element, and a trans-acting transcription factor, FIS.</clue>
</event>
<sentence id="S4">In this study, we examine the effects of <term sem="Transcription_Factor" id="T8" lex="FIS">FIS</term> and <term sem="DNA" id="T9" lex="the_UP_element">the UP element</term> <term sem="SPAN" id="T10" lex="at_the_other_six_rrn_P1_promoters">at <term sem="Promoter" id="T11" lex="the_other_six_rrn_P1_promoters">the other six rrn P1 promoters</term></term>.</sentence>
<event id="E3">
<type class="GRE" />
<Agent idref="T8" idref1="T9" />
<Location idref="T10" />
<clue>In this study, we examine the <clueType>effects</clueType> of FIS and the UP element at the other six rrn P1 promoters.</clue>
</event>
<sentence id="S5">We find that UP elements are present at all of the rrn P1 promoters, but they make different relative contributions to promoter activity.</sentence>
<sentence id="S6">Similarly, <term sem="Transcription_Factor" id="T12" lex="FIS">FIS</term> binds <term sem="SPAN" id="T13" lex="upstream_of">upstream of</term>, and activates, <term sem="Promoter" id="T14" lex="all_seven_rrn_P1_promoters">all seven rrn P1 promoters</term> but to different extents.</sentence>
<event id="E4">
<type class="GRE" />
<Agent idref="T12" />
<Destination idref="T13" idref1="T14" />
<clue>Similarly, FIS <clueType>binds</clueType> upstream of, and activates, all seven rrn P1 promoters but to different extents.</clue>
</event>
<event id="E5">
<type class="Gene_Activation" />
<Agent idref="T12" />
<Theme idref="T14" />
<clue>Similarly, FIS binds upstream of, and <clueType>activates</clueType>, all seven rrn P1 promoters but to different extents.</clue>
</event>
<sentence id="S7">The total number of FIS binding sites, as well as their positions relative to the transcription start site, differ at each rrn P1 promoter.</sentence>
<sentence id="S8">Surprisingly, the FIS sites upstream of site I play a much larger role in transcription from <term sem="Promoter" id="T15" lex="most_rrn_P1_promoters">most rrn P1 promoters</term> compared to rrnB P1.</sentence>
<event id="E6">
<type class="Transcription" />
<Source idref="T15" />
<clue>Surprisingly, the FIS sites upstream of site I play a much larger role in <clueType>transcription</clueType> from most rrn P1 promoters compared to rrnB P1.</clue>
</event>
<sentence id="S9">Our studies indicate that the overall activities of the seven rrn P1 promoters are similar, and the same contributors are responsible for these high activities, but these inputs make different relative contributions and may act through slightly different mechanisms at each promoter.</sentence>
<sentence id="S10">These studies have implications for the control of gene expression of <term sem="Gene" id="T16" lex="unlinked_multigene_families">unlinked multigene families</term>.</sentence>
<event id="E7">
<type class="GRE" />
<Theme idref="E8" />
<clue>These studies have implications for the <clueType>control</clueType> of gene expression of unlinked multigene families.</clue>
</event>
<event id="E8">
<type class="Gene_Expression" />
<Theme idref="T16" />
<clue>These studies have implications for the control of gene <clueType>expression</clueType> of unlinked multigene families.</clue>
</event>
</AbstractText>
</Abstract>
</Article>
</MedlineCitation>
</PubmedArticle>
</PubmedArticleSet>
</Annotation>
