<?xml version="1.0" encoding="utf-8"?>
<!DOCTYPE Annotation PUBLIC "-//GREC//DTD GREC EVENT ANNOTATION//EN" "../GRECResources/GREC_event.dtd">
<Annotation created="11/5/2009" creator="a2" annotates="http://www.ncbi.nlm.nih.gov/entrez/eutils/efetch.fcgi?db=pubmed&amp;retmode=xml&amp;rettype=medline&amp;id=9135990">
<PubmedArticleSet>
<PubmedArticle>
<MedlineCitation>
<PMID>9135990</PMID>
<Article>
<ArticleTitle>
<sentence id="S1"><term sem="Repressor" id="T1" lex="BCL6">BCL6</term> can repress transcription from <term sem="Promoter" id="T2" lex="the_human_immunodeficiency_virus_type_I_promoter/enhancer_region">the human immunodeficiency virus type I promoter/enhancer region</term>.</sentence>
<event id="E1">
<type class="GRE" />
<Agent idref="T1" />
<Theme idref="E2" />
<clue>BCL6 can <clueType>repress</clueType> transcription from the human immunodeficiency virus type I promoter/enhancer region.</clue>
</event>
<event id="E2">
<type class="Transcription" />
<Source idref="T2" />
<clue>BCL6 can repress <clueType>transcription</clueType> from the human immunodeficiency virus type I promoter/enhancer region.</clue>
</event>
</ArticleTitle>
<Abstract>
<AbstractText>
<sentence id="S3"><term sem="Gene" id="T3" lex="The_gene_BCL6">The gene BCL6</term> encodes <term sem="Repressor" id="T4" lex="a_zinc_finger_protein">a zinc finger protein</term> with similarities to transcription factors.</sentence>
<event id="E3">
<type class="GRE" />
<Agent idref="T3" />
<Theme idref="T4" />
<clue>The gene BCL6 <clueType>encodes</clueType> a zinc finger protein with similarities to transcription factors.</clue>
</event>
<sentence id="S4">We previously reported that a number of viral genomes, including human immunodeficiency virus type I (HIV-1), contain sequences which are similar to the BCL6 DNA-binding consensus in their promoter regions.</sentence>
<sentence id="S5">Electrophoretic mobility shift assays showed that <term sem="Repressor" id="T5" lex="the_full-length_BCL6_protein">the full-length BCL6 protein</term> extracted from transfected COS cells and <term sem="Protein" id="T6" lex="a_bacterially_expressed_truncated_protein">a bacterially expressed truncated protein</term> containing the BCL6 zinc fingers can bind <term sem="SPAN" id="T7" lex="specifically">specifically</term> to <term sem="DNA" id="T8" lex="DNA">DNA</term> from the U3 promoter/enhancer region of HIV-1.</sentence>
<event id="E4">
<type class="GRE" />
<Agent idref="T5" idref1="T6" />
<Manner idref="T7" />
<Destination idref="T8" />
<clue>Electrophoretic mobility shift assays showed that the full-length BCL6 protein extracted from transfected COS cells and a bacterially expressed truncated protein containing the BCL6 zinc fingers can <clueType>bind</clueType> specifically to DNA from the U3 promoter/enhancer region of HIV-1.</clue>
</event>
<sentence id="S6">Transient transfections were performed to analyze the effects of <term sem="Repressor" id="T9" lex="the_BCL6_protein">the BCL6 protein</term> on <term sem="Enzyme" id="T10" lex="luciferase">luciferase</term> expression driven by the HIV-1 long terminal repeat (<term sem="DNA" id="T11" lex="LTR">LTR</term>) sequences.</sentence>
<event id="E5">
<type class="GRE" />
<Agent idref="T9" />
<Theme idref="E6" />
<clue>Transient transfections were performed to analyze the <clueType>effects</clueType> of the BCL6 protein on luciferase expression driven by the HIV-1 long terminal repeat (LTR) sequences.</clue>
</event>
<event id="E6">
<type class="Gene_Activation" />
<Theme idref="T10" />
<clue>Transient transfections were performed to analyze the effects of the BCL6 protein on luciferase <clueType>expression</clueType> driven by the HIV-1 long terminal repeat (LTR) sequences.</clue>
</event>
<event id="E7">
<type class="GRE" />
<Agent idref="T11" />
<Theme idref="E6" />
<clue>Transient transfections were performed to analyze the effects of the BCL6 protein on luciferase expression <clueType>driven</clueType> by the HIV-1 long terminal repeat (LTR) sequences.</clue>
</event>
<sentence id="S7"><term sem="Repressor" id="T12" lex="Full-length_BCL6">Full-length BCL6</term> significantly repressed <term sem="SPAN" id="T13" lex="luciferase_activity">luciferase activity</term> compared with multiple controls.</sentence>
<event id="E8">
<type class="GRE" />
<Agent idref="T12" />
<Theme idref="T13" />
<clue>Full-length BCL6 significantly <clueType>repressed</clueType> luciferase activity compared with multiple controls.</clue>
</event>
<sentence id="S8">We conclude that <term sem="Repressor" id="T14" lex="the_BCL6_protein">the BCL6 protein</term> can bind to <term sem="Enhancer" id="T15" lex="the_HIV-1_promoter-enhancer_region">the HIV-1 promoter-enhancer region</term> and contains a domain upstream of <term sem="Domain" id="T16" lex="its_zinc_fingers">its zinc fingers</term> that can repress transcription from <term sem="Enhancer" id="T17" lex="the_HIV-1_LTR">the HIV-1 LTR</term>.</sentence>
<event id="E9">
<type class="GRE" />
<Agent idref="T14" />
<Theme idref="T15" />
<clue>We conclude that the BCL6 protein can <clueType>bind</clueType> to the HIV-1 promoter-enhancer region and contains a domain upstream of its zinc fingers that can repress transcription from the HIV-1 LTR.</clue>
</event>
<event id="E10">
<type class="GRE" />
<Agent idref="T16" />
<Theme idref="E11" />
<clue>We conclude that the BCL6 protein can bind to the HIV-1 promoter-enhancer region and contains a domain upstream of its zinc fingers that can <clueType>repress</clueType> transcription from the HIV-1 LTR.</clue>
</event>
<event id="E11">
<type class="Transcription" />
<Source idref="T17" />
<clue>We conclude that the BCL6 protein can bind to the HIV-1 promoter-enhancer region and contains a domain upstream of its zinc fingers that can repress <clueType>transcription</clueType> from the HIV-1 LTR.</clue>
</event>
</AbstractText>
</Abstract>
</Article>
</MedlineCitation>
</PubmedArticle>
</PubmedArticleSet>
</Annotation>
