<?xml version="1.0" encoding="utf-8"?>
<!DOCTYPE Annotation PUBLIC "-//GREC//DTD GREC EVENT ANNOTATION//EN" "../GRECResources/GREC_event.dtd">
<Annotation created="11/5/2009" creator="mobbedo2" annotates="http://www.ncbi.nlm.nih.gov/entrez/eutils/efetch.fcgi?db=pubmed&amp;retmode=xml&amp;rettype=medline&amp;id=9787080">
<PubmedArticleSet>
<PubmedArticle>
<MedlineCitation>
<PMID>9787080</PMID>
<Article>
<ArticleTitle>
<sentence id="S1">Characterization of a human homologue of the Saccharomyces cerevisiae transcription factor spt3 (SUPT3H).</sentence>
</ArticleTitle>
<Abstract>
<AbstractText>
<sentence id="S3"><term sem="Transcription_Factor" id="T1" lex="Spt3">Spt3</term> is a Saccharomyces cerevisiae transcription factor that is required <term sem="SPAN" id="T2" lex="in_vivo">in vivo</term> for the transcription of a number of <term sem="Gene" id="T3" lex="RNA_polymerase_II-transcribed_genes">RNA polymerase II-transcribed genes</term>.</sentence>
<event id="E1">
<type class="GRE" />
<Theme idref="T1" />
<Condition idref="T2" />
<Purpose idref="E2" />
<clue>Spt3 is a Saccharomyces cerevisiae transcription factor that is <clueType>required</clueType> in vivo for the transcription of a number of RNA polymerase II-transcribed genes.</clue>
</event>
<event id="E2">
<type class="Transcription" />
<Theme idref="T3" />
<clue>Spt3 is a Saccharomyces cerevisiae transcription factor that is required in vivo for the <clueType>transcription</clueType> of a number of RNA polymerase II-transcribed genes.</clue>
</event>
<sentence id="S4">We report the cloning of <term sem="Gene" id="T4" lex="the_gene">the gene</term> encoding the human homologue of Spt3, <term sem="Transcription_Factor" id="T5" lex="SUPT3H">SUPT3H</term>, and its initial functional analysis.</sentence>
<event id="E3">
<type class="GRE" />
<Agent idref="T4" />
<Theme idref="T5" />
<clue>We report the cloning of the gene <clueType>encoding</clueType> the human homologue of Spt3, SUPT3H, and its initial functional analysis.</clue>
</event>
<sentence id="S5">The human and yeast Spt3 homologues share an overall identity of 30% that defines three conserved regions, suggesting possible functional domains.</sentence>
<sentence id="S6">To determine whether SUPT3H is a true functional Spt3 homologue, we tested for complementation of an spt3Delta mutation in yeast.</sentence>
<sentence id="S7">While expression of <term sem="Transcription_Factor" id="T6" lex="the_full-length_SUPT3H">the full-length SUPT3H</term> is <term sem="SPAN" id="T7" lex="unable">unable</term> to complement <term sem="Mutation" id="T8" lex="an_spt3Delta_mutation">an spt3Delta mutation</term>, expression of <term sem="Gene" id="T9" lex="a_human-yeast_chimeric_gene">a human-yeast chimeric gene</term> that contains 42% human sequences can <term sem="SPAN" id="T10" lex="partially">partially</term> complement <term sem="Mutation" id="T11" lex="an_spt3Delta_mutation">an spt3Delta mutation</term>.</sentence>
<event id="E4">
<type class="Gene_Expression" />
<Theme idref="T6" />
<clue>While <clueType>expression</clueType> of the full-length SUPT3H is unable to complement an spt3Delta mutation, expression of a human-yeast chimeric gene that contains 42% human sequences can partially complement an spt3Delta mutation.</clue>
</event>
<event id="E5">
<type class="GRE" />
<Agent idref="T6" />
<Theme idref="T8" />
<Manner idref="T7" />
<clue>While expression of the full-length SUPT3H is unable to <clueType>complement</clueType> an spt3Delta mutation, expression of a human-yeast chimeric gene that contains 42% human sequences can partially complement an spt3Delta mutation.</clue>
</event>
<event id="E6">
<type class="Gene_Expression" />
<Theme idref="T9" />
<clue>While expression of the full-length SUPT3H is unable to complement an spt3Delta mutation, <clueType>expression</clueType> of a human-yeast chimeric gene that contains 42% human sequences can partially complement an spt3Delta mutation.</clue>
</event>
<event id="E7">
<type class="GRE" />
<Agent idref="E6" />
<Theme idref="T11" />
<Manner idref="T10" />
<clue>While expression of the full-length SUPT3H is unable to complement an spt3Delta mutation, expression of a human-yeast chimeric gene that contains 42% human sequences can partially <clueType>complement</clueType> an spt3Delta mutation.</clue>
</event>
<sentence id="S8">These data suggest that <term sem="SPAN" id="T12" lex="the_transcriptional_control">the transcriptional control</term> carried out by Spt3 has been conserved <term sem="SPAN" id="T13" lex="from_yeast_to_human">from <term sem="Wild_Type_Organism" id="T14" lex="yeast">yeast</term> to human</term><term sem="Wild_Type_Organism" id="T15" lex="human"></term>.</sentence>
<event id="E8">
<type class="GRE" />
<Theme idref="T12" />
<Location idref="T13" />
<clue>These data suggest that the transcriptional control carried out by Spt3 has been <clueType>conserved</clueType> from yeast to human.</clue>
</event>
</AbstractText>
</Abstract>
</Article>
</MedlineCitation>
</PubmedArticle>
</PubmedArticleSet>
</Annotation>
