<?xml version="1.0" encoding="utf-8"?>
<!DOCTYPE Annotation PUBLIC "-//GREC//DTD GREC EVENT ANNOTATION//EN" "../GRECResources/GREC_event.dtd">
<Annotation created="11/5/2009" creator="a2" annotates="http://www.ncbi.nlm.nih.gov/entrez/eutils/efetch.fcgi?db=pubmed&amp;retmode=xml&amp;rettype=medline&amp;id=8577250">
<PubmedArticleSet>
<PubmedArticle>
<MedlineCitation>
<PMID>8577250</PMID>
<Article>
<ArticleTitle>
<sentence id="S1"><term sem="Regulator" id="T1" lex="The_global_regulatory_protein_FruR">The global regulatory protein FruR</term> modulates <term sem="SPAN" id="T2" lex="the_direction_of_carbon_flow">the direction of carbon flow</term> <term sem="SPAN" id="T3" lex="in_Escherichia_coli">in <term sem="Wild_Type_Bacteria" id="T4" lex="Escherichia_coli">Escherichia coli</term></term>.</sentence>
<event id="E1">
<type class="GRE" />
<Agent idref="T1" />
<Theme idref="T2" />
<Location idref="T3" />
<clue>The global regulatory protein FruR <clueType>modulates</clueType> the direction of carbon flow in Escherichia coli.</clue>
</event>
</ArticleTitle>
<Abstract>
<AbstractText>
<sentence id="S3">The Escherichia coli fructose repressor, <term sem="Regulator" id="T5" lex="FruR">FruR</term>, is known to regulate expression of <term sem="Gene" id="T6" lex="several_genes">several genes</term> concerned with carbon utilization.</sentence>
<event id="E2">
<type class="GRE" />
<Agent idref="T5" />
<Theme idref="E3" />
<clue>The Escherichia coli fructose repressor, FruR, is known to <clueType>regulate</clueType> expression of several genes concerned with carbon utilization.</clue>
</event>
<event id="E3">
<type class="Gene_Expression" />
<Theme idref="T6" />
<clue>The Escherichia coli fructose repressor, FruR, is known to regulate <clueType>expression</clueType> of several genes concerned with carbon utilization.</clue>
</event>
<sentence id="S4">Using <term sem="Operator" id="T7" lex="a_previously_derived_consensus_sequence">a previously derived consensus sequence</term> for <term sem="Regulator" id="T8" lex="FruR">FruR</term> binding, additional potential operators were identified and tested for <term sem="Regulator" id="T9" lex="FruR">FruR</term> binding in DNA band migration retardation assays.</sentence>
<event id="E4">
<type class="GRE" />
<Agent idref="T8" />
<Destination idref="T7" />
<clue>Using a previously derived consensus sequence for FruR <clueType>binding</clueType>, additional potential operators were identified and tested for FruR binding in DNA band migration retardation assays.</clue>
</event>
<event id="E5">
<type class="GRE" />
<Agent idref="T9" />
<clue>Using a previously derived consensus sequence for FruR binding, additional potential operators were identified and tested for FruR <clueType>binding</clueType> in DNA band migration retardation assays.</clue>
</event>
<sentence id="S5"><term sem="Operator" id="T10" lex="Operators">Operators</term> in the control regions of operons concerned with carbon metabolism bound <term sem="Regulator" id="T11" lex="FruR">FruR</term>, while those in operons not concerned with carbon metabolism did not.</sentence>
<event id="E6">
<type class="GRE" />
<Agent idref="T10" />
<Destination idref="T11" />
<clue>Operators in the control regions of operons concerned with carbon metabolism <clueType>bound</clueType> FruR, while those in operons not concerned with carbon metabolism did not.</clue>
</event>
<sentence id="S6">In vivo assays with transcriptional lacZ fusions showed that <term sem="Regulator" id="T12" lex="FruR">FruR</term> controls the expression of <term sem="Gene" id="T13" lex="FruR_operator-containing_genes">FruR operator-containing genes</term> encoding <term sem="Enzyme" id="T14" lex="key_enzymes">key enzymes</term> of virtually every major pathway of carbon metabolism.</sentence>
<event id="E7">
<type class="GRE" />
<Agent idref="T12" />
<Theme idref="E8" />
<clue>In vivo assays with transcriptional lacZ fusions showed that FruR <clueType>controls</clueType> the expression of FruR operator-containing genes encoding key enzymes of virtually every major pathway of carbon metabolism.</clue>
</event>
<event id="E8">
<type class="Gene_Activation" />
<Theme idref="T13" />
<clue>In vivo assays with transcriptional lacZ fusions showed that FruR controls the <clueType>expression</clueType> of FruR operator-containing genes encoding key enzymes of virtually every major pathway of carbon metabolism.</clue>
</event>
<event id="E9">
<type class="GRE" />
<Agent idref="T13" />
<Theme idref="T14" />
<clue>In vivo assays with transcriptional lacZ fusions showed that FruR controls the expression of FruR operator-containing genes <clueType>encoding</clueType> key enzymes of virtually every major pathway of carbon metabolism.</clue>
</event>
<sentence id="S7">Moreover, a <term sem="SPAN" id="T15" lex="fruR_null">fruR null</term> mutation altered <term sem="SPAN" id="T16" lex="the_rates_of_utilization">the rates of utilization</term> of at least 36 carbon sources.</sentence>
<event id="E10">
<type class=" Null_Mutation" />
<Manner idref="T15" />
<clue>Moreover, a fruR null <clueType>mutation</clueType> altered the rates of utilization of at least 36 carbon sources.</clue>
</event>
<event id="E11">
<type class="GRE" />
<Agent idref="E10" />
<Theme idref="T16" />
<clue>Moreover, a fruR null mutation <clueType>altered</clueType> the rates of utilization of at least 36 carbon sources.</clue>
</event>
<sentence id="S8">In general, oxidation rates for glycolytic substances were enhanced while those for gluconeogenic substances were depressed.</sentence>
<sentence id="S9">Alignment of FruR operators revealed that <term sem="Operator" id="T17" lex="the_consensus_sequence">the consensus sequence</term> for <term sem="Regulator" id="T18" lex="FruR">FruR</term> binding is the same for <term sem="Operon" id="T19" lex="operons">operons</term> that are activated and repressed by <term sem="Regulator" id="T20" lex="FruR">FruR</term> and permitted formulation of <term sem="Operator" id="T21" lex="a_revised_FruR-binding_consensus_sequence">a revised FruR-binding consensus sequence</term>.</sentence>
<event id="E12">
<type class="GRE" />
<Agent idref="T18" />
<Destination idref="T17" />
<clue>Alignment of FruR operators revealed that the consensus sequence for FruR <clueType>binding</clueType> is the same for operons that are activated and repressed by FruR and permitted formulation of a revised FruR-binding consensus sequence.</clue>
</event>
<event id="E13">
<type class="GRE" />
<Agent idref="T20" />
<Theme idref="T19" />
<clue>Alignment of FruR operators revealed that the consensus sequence for FruR binding is the same for operons that are <clueType>activated</clueType> and repressed by FruR and permitted formulation of a revised FruR-binding consensus sequence.</clue>
</event>
<event id="E14">
<type class="GRE" />
<Agent idref="T20" />
<Theme idref="T19" />
<clue>Alignment of FruR operators revealed that the consensus sequence for FruR binding is the same for operons that are activated and <clueType>repressed</clueType> by FruR and permitted formulation of a revised FruR-binding consensus sequence.</clue>
</event>
<event id="E15">
<type class="GRE" />
<Agent idref="T17" />
<Theme idref="E16" />
<clue>Alignment of FruR operators revealed that the consensus sequence for FruR binding is the same for operons that are activated and repressed by FruR and <clueType>permitted</clueType> formulation of a revised FruR-binding consensus sequence.</clue>
</event>
<event id="E16">
<type class="GRE" />
<Theme idref="T21" />
<clue>Alignment of FruR operators revealed that the consensus sequence for FruR binding is the same for operons that are activated and repressed by FruR and permitted <clueType>formulation</clueType> of a revised FruR-binding consensus sequence.</clue>
</event>
<sentence id="S10">The reported observations indicate that <term sem="Regulator" id="T22" lex="FruR">FruR</term> modulates the direction of carbon flow by <term sem="SPAN" id="T23" lex="transcriptional">transcriptional</term> activation of <term sem="Gene" id="T24" lex="genes">genes</term> encoding <term sem="Enzyme" id="T25" lex="enzymes">enzymes</term> concerned with oxidative and gluconeogenic carbon flow and by <term sem="Gene_Repression" id="T26" lex="repression">repression</term> of those concerned with fermentative carbon flow.</sentence>
<event id="E17">
<type class="Gene_Repression" />
<Theme idref="T24" />
<Manner idref="T23" />
<clue>The reported observations indicate that FruR modulates the direction of carbon flow by transcriptional <clueType>activation</clueType> of genes encoding enzymes concerned with oxidative and gluconeogenic carbon flow and by repression of those concerned with fermentative carbon flow.</clue>
</event>
<event id="E18">
<type class="GRE" />
<Agent idref="T24" />
<Theme idref="T25" />
<clue>The reported observations indicate that FruR modulates the direction of carbon flow by transcriptional activation of genes <clueType>encoding</clueType> enzymes concerned with oxidative and gluconeogenic carbon flow and by repression of those concerned with fermentative carbon flow.</clue>
</event>
</AbstractText>
</Abstract>
</Article>
</MedlineCitation>
</PubmedArticle>
</PubmedArticleSet>
</Annotation>
